{
  "id": "step_fedcba9876543210fedcba9876543210",
  "run_id": "run_ffeeddccbbaa99887766554433221100",
  "node": "DATA_PREPARATION",
  "attempt": 2,
  "input_hash": null,
  "status": "FAILED",
  "failure_class": "DATA_DEFECT",
  "failure_message": "附件列数与 Schema 不匹配。",
  "created_at": "2026-08-04T09:01:00Z",
  "started_at": "2026-08-04T09:01:00Z",
  "ended_at": "2026-08-04T09:02:00Z"
}
